name,genre
Koukou Butouden Crows,"Action, School, Shounen"
Koukou Tekken-den Tough,"Action, Martial Arts, Shounen"
Kounai Shasei,"Comedy, Hentai, Magic"
Kouryuu Densetsu Villgust,"Action, Adventure, Comedy, Fantasy, Romance"
Koushoku Ichidai Otoko,"Drama, Hentai, Historical, Psychological"
Kousoku Denjin Albegus,Mecha
Koutetsu Jeeg,"Action, Demons, Mecha, Sci-Fi, Shounen"
Koutetsu Sangokushi,"Adventure, Historical, Shounen"
Koutetsu Sangokushi Special,"Historical, Shounen"
Koutetsu Tenshi Kurumi,"Adventure, Comedy, Drama, Historical, Mecha, Military, Romance, Shounen"
Koutetsu Tenshi Kurumi 2,"Comedy, Mecha, Romance, Sci-Fi, Shoujo Ai, Shounen"
Koutetsu Tenshi Kurumi Encore,"Comedy, Historical, Romance, Sci-Fi, Shounen"
Koutetsu Tenshi Kurumi Zero,"Drama, Romance, Sci-Fi"
Koutetsu no Majo Annerose,"Action, Hentai, Supernatural"
Koutetsujou no Kabaneri,"Action, Drama, Fantasy, Horror"
Koutetsushin Jeeg,"Mecha, Sci-Fi"
Kouya no Shounen Isamu,"Action, Adventure, Shounen"
Kouya no Yobigoe: Hoero Buck,"Adventure, Drama"
Kowabon,Horror
Kowaku no Toki,Hentai
Kowarekake no Orgel,"Drama, Music, Sci-Fi, Slice of Life"
Kowarekake no Orgel (Movie),"Drama, Music, Sci-Fi, Slice of Life"
Kowarekake no Orgel Special,"Drama, Music, Sci-Fi, Seinen, Slice of Life"
Kowaremono,Hentai
Kowaremono II,Hentai
Kowaremono The Animation,"Hentai, School"
Kowaremono: Risa Plus The Animation,Hentai
Kowaremono: Risa The Animation,Hentai
Koyomimonogatari,"Comedy, Mystery, Supernatural"
Kudan,Fantasy
Kugutsu Ai: Doura Gaiden,Hentai
Kuiba: Zhi Shiwanhuoji,"Action, Adventure, Fantasy, Kids"
Kujakuou,"Action, Demons, Horror"
Kujibiki Unbalance,"Comedy, Romance, School"
Kujibiki♥Unbalance,"Comedy, Romance, School"
Kujira (1952),Fantasy
Kujira no Chouyaku,"Drama, Fantasy, Kids"
Kujira no Josephina,"Adventure, Fantasy"
Kujiratori,Adventure
Kuma Miko,"Comedy, Seinen, Slice of Life"
Kuma Miko Specials,"Comedy, Seinen"
Kuma ni Kuwarenu Otoko,"Adventure, Music"
Kumi to Tulip,"Kids, Sci-Fi"
Kumo ga Haretara,Music
Kumo no Ito,Fantasy
"Kumo no Mukou, Yakusoku no Basho","Drama, Military, Romance, Sci-Fi"
Kumo no You ni Kaze no You ni,"Adventure, Drama, Historical, Romance"
Kumo to Tulip,Adventure
Kunoichi Bakumatsu Kitan,Hentai
Kunoichi Gakuen Ninpouchou,"Action, Comedy, Demons, Hentai, Martial Arts, School"
Kunoichi Sakuya,Hentai
Kurage no Shokudou,"Drama, Slice of Life"
Kuragehime,"Comedy, Josei, Slice of Life"
Kuragehime: Eiyuu Retsuden☆,"Comedy, Josei, Slice of Life"
Kuragehime: Soreike! Amars Tankentai,"Adventure, Comedy, Josei"
Kurai Mirai,Hentai
Kuraibito,Hentai
Kurau Phantom Memory,"Action, Drama, Sci-Fi, Space, Super Power"
Kurayami Santa,"Historical, Supernatural"
Kure-nai,"Comedy, Drama, Martial Arts"
Kure-nai OVA,"Action, Comedy"
Kurenai Sanshirou,"Action, Martial Arts, Sports"
Kurenai no Buta,"Action, Adventure, Comedy, Drama, Historical, Military, Romance"
Kuro,"Kids, Music"
Kuro Ai: Hitoyozumakan Inkou Rannyuuroku,Hentai
Kuro Nyago,Fantasy
Kuro ga Ita Natsu,"Drama, Historical"
Kuro no Danshou,"Hentai, Horror"
Kuro no Sumika: Chronus,Psychological
Kuro to Kin no Akanai Kagi.,"Romance, Shoujo"
Kurogane Communication,"Action, Adventure, Drama, Sci-Fi"
Kurogane no Linebarrels,"Action, Mecha, Sci-Fi"
Kurogane no Linebarrels Specials,"Action, Comedy, Ecchi, Mecha"
Kurohime: Shikkoku no Yakata,Hentai
Kuroi Kikori to Shiroi Kikori,Fantasy
Kuroinu: Kedakaki Seijo wa Hakudaku ni Somaru,"Action, Fantasy, Hentai"
Kurokami The Animation,"Action, Martial Arts, Super Power"
Kurokami: Intermission,"Action, Martial Arts, Super Power"
Kurokami: Tora to Tsubasa,"Action, Martial Arts, Super Power"
Kuroko no Basket,"Comedy, School, Shounen, Sports"
Kuroko no Basket 2nd Season,"Comedy, School, Shounen, Sports"
Kuroko no Basket 2nd Season NG-shuu,"Comedy, Sports"
Kuroko no Basket 3rd Season,"Comedy, School, Shounen, Sports"
Kuroko no Basket 3rd Season NG-shuu,"Comedy, Sports"
Kuroko no Basket Movie 1: Winter Cup Soushuuhen - Kage to Hikari,"School, Shounen, Sports"
Kuroko no Basket Movie 2: Winter Cup Soushuuhen - Namida no Saki e,"School, Shounen, Sports"
Kuroko no Basket Movie 3: Winter Cup Soushuuhen - Tobira no Mukou,"Comedy, Shounen, Sports"
Kuroko no Basket NG-shuu,"Comedy, School, Shounen, Sports"
Kuroko no Basket: Baka ja Katenai no yo!,"Comedy, School, Shounen, Sports"
Kuroko no Basket: Mou Ikkai Yarimasen ka,"Comedy, School, Shounen, Sports"
Kuroko no Basket: Oshaberi Demo Shimasen ka,"Comedy, School, Shounen, Sports"
Kuroko no Basket: Oshaberi Shiyokka,"Comedy, School, Shounen, Sports"
Kuroko no Basket: Saikou no Present Desu,"Action, School, Shounen, Sports"
Kuroko no Basket: Tip Off,"Comedy, School, Shounen, Sports"
Kuromajo-san ga Tooru!!,"Comedy, Magic, School, Slice of Life"
Kuromukuro,"Action, Mecha, Sci-Fi"
Kuroshitsuji,"Action, Comedy, Demons, Fantasy, Historical, Shounen, Supernatural"
Kuroshitsuji II,"Action, Comedy, Demons, Fantasy, Shounen, Supernatural"
Kuroshitsuji II Specials,"Comedy, Fantasy, Parody, Shounen, Supernatural"
Kuroshitsuji Picture Drama,"Demons, Supernatural"
Kuroshitsuji Recap,"Action, Demons, Fantasy, Shounen, Supernatural"
Kuroshitsuji Special,"Comedy, Demons, Parody"
Kuroshitsuji: Book of Circus,"Comedy, Demons, Fantasy, Historical, Shounen, Supernatural"
Kuroshitsuji: Book of Murder,"Comedy, Demons, Fantasy, Historical, Mystery, Shounen, Supernatural"
Kurozuka,"Action, Drama, Historical, Horror, Romance, Sci-Fi, Vampire"
Kuruneko,"Comedy, Slice of Life"
Kuruneko Season 2,"Comedy, Slice of Life"
Kuruneko: Nyaalock Holmes no Bouken,"Comedy, Slice of Life"
Kurutta Kyoutou: Danzai no Gakuen,Hentai
Kusatta Kyoushi no Houteishiki,"Comedy, Romance, Shounen Ai"
KutsuDaru.,"Fantasy, Kids, School, Slice of Life"
Kutsuya to Kobito,"Fantasy, Kids"
Kuttsukiboshi,"Drama, Romance, Shoujo Ai, Supernatural"
Kuuchuu Buranko,"Comedy, Drama, Psychological, Seinen"
Kuusen Madoushi Kouhosei no Kyoukan,"Action, Drama, Fantasy, Magic, School"
Kuusen Madoushi Kouhosei no Kyoukan OVA,"Action, Drama, Fantasy, Magic, School"
Kuusou no Sora Tobu Kikaitachi,Historical
Kyattou Ninden Teyandee,"Action, Comedy, Mecha, Sci-Fi, Shounen, Super Power"
Kyojin no Hoshi,"Drama, Sports"
Kyokugen Dasshutsu Adv: Zennin Shibou Desu Prologue,Mystery
Kyokujitsu no Kantai,"Action, Drama, Historical, Military"
Kyonyuu Fantasy,"Demons, Fantasy, Harem, Hentai, Supernatural"
Kyonyuu Kazoku Saimin,Hentai
Kyonyuu Try!: Tanki Shuuchuu Chichi Momi Lesson,Hentai
Kyoro-chan,"Adventure, Comedy, Fantasy"
Kyoto Animation: Ajisai-hen,Magic
Kyoto Animation: Hana-hen,Slice of Life
Kyoto Animation: Hassou-hen,Fantasy
Kyoto Animation: Hoshi-hen,Fantasy
Kyoto Animation: Ikitaku Naru Omise-hen,Sci-Fi
Kyoto Animation: Kasa-hen,Fantasy
Kyoto Animation: Megane-hen,Thriller
Kyoto Animation: Sora-hen,Slice of Life
Kyoto Animation: Suiei-hen,Sports
Kyou kara Maou!,"Adventure, Comedy, Demons, Fantasy, Shoujo"
Kyou kara Maou! 3rd Series,"Adventure, Comedy, Fantasy, Romance, Shoujo"
Kyou kara Maou! R,"Adventure, Comedy, Fantasy"
Kyou kara Ore wa!!,"Comedy, Shounen"
Kyou no 5 no 2,"Comedy, Ecchi, School, Seinen"
Kyou no 5 no 2 (TV),"Comedy, Ecchi, School, Seinen"
Kyou no 5 no 2 (TV): Takarabako,"Comedy, Ecchi, School, Seinen"
Kyou no 5 no 2 Kagai Jugyou: Mizukake,"Comedy, Ecchi, School, Seinen"
Kyou no Asuka Show,"Comedy, Ecchi, Seinen"
"Kyou, Koi wo Hajimemasu","Romance, School, Shoujo"
Kyoufu Densetsu Kaiki! Frankenstein,"Drama, Horror, Sci-Fi"
Kyoufu Shinbun,"Horror, Shounen"
Kyoufu no Bio Ningen Saishuu Kyoushi,"Action, Adventure, Comedy, School, Supernatural"
Kyougoku Natsuhiko: Kousetsu Hyaku Monogatari,"Fantasy, Historical, Horror, Mystery, Psychological, Supernatural"
Kyouhaku II (Second): Mou Hitotsu no Ashita The Animation,Hentai
Kyouhaku: Owaranai Ashita,Hentai
Kyouiku Shidou The Animation,Hentai
Kyoukai no Kanata,"Fantasy, Slice of Life, Supernatural"
Kyoukai no Kanata Movie: I&#039;ll Be Here - Kako-hen,"Action, Fantasy, Supernatural"
Kyoukai no Kanata Movie: I&#039;ll Be Here - Kako-hen - Yakusoku no Kizuna,Music
Kyoukai no Kanata Movie: I&#039;ll Be Here - Mirai-hen,"Fantasy, Slice of Life, Supernatural"
Kyoukai no Kanata: Idol Saiban! Mayoi Nagara mo Kimi wo Sabaku Tami,Comedy
Kyoukai no Kanata: Mini Theater,"Slice of Life, Supernatural"
Kyoukai no Kanata: Shinonome,"Fantasy, Slice of Life, Supernatural"
Kyoukai no Rinne,"Comedy, Supernatural"
Kyoukai no Rinne (TV),"Comedy, Romance, School, Shounen, Supernatural"
Kyoukai no Rinne (TV) 2nd Season,"Comedy, Romance, School, Shounen, Supernatural"
Kyoukaisenjou no Horizon,"Action, Fantasy"
Kyoukaisenjou no Horizon II,"Action, Fantasy, Sci-Fi"
Kyoukaisenjou no Horizon Specials,"Comedy, Fantasy, School"
Kyoukasho ni Nai!,"Comedy, Ecchi"
Kyouran Kazoku Nikki,"Comedy, Sci-Fi"
Kyouryuu Boukenki Jura Tripper,"Adventure, Drama, Fantasy, Sci-Fi"
Kyouryuu Daisensou Aizenborg,"Action, Mecha"
Kyoushirou to Towa no Sora,"Drama, Magic, Romance, Shounen"
Kyoushirou to Towa no Sora Specials,"Drama, Magic, Romance, Shounen"
Kyoushoku Soukou Guyver,"Action, Horror, Sci-Fi, Super Power"
Kyoushoku Soukou Guyver (1989),"Action, Horror, Sci-Fi, Super Power"
Kyoushoku Soukou Guyver (2005),"Adventure, Sci-Fi, Shounen"
Kyoushoku Soukou Guyver II,"Action, Adventure, Drama, Horror, Sci-Fi"
Kyousou Giga,"Action, Fantasy, Supernatural"
Kyousou Giga (2012),"Action, Fantasy, Supernatural"
Kyousou Giga (TV),"Action, Fantasy, Supernatural"
Kyousou Giga (TV) Recaps,"Action, Fantasy, Supernatural"
Kyubi no Kitsune to Tobimaru (Sesshoseki),"Demons, Fantasy"
Kyutai Panic Adventure Returns!,"Action, Shounen, Super Power"
Kyuuketsuhime Miyu,"Action, Demons, Drama, Horror, Vampire"
Kyuuketsuhime Miyu (TV),"Action, Demons, Drama, Horror, Vampire"
Kyuuketsuki,"Hentai, Vampire"
Kyuukyoku no Sex Adventure Kamasutra,"Action, Comedy, Hentai, Romance, Supernatural"
Kämpfer,"Action, Comedy, Ecchi, Romance, School, Shoujo Ai, Super Power"
Kämpfer Picture Drama,Comedy
Kämpfer für die Liebe,"Action, Comedy, Ecchi, Shoujo Ai, Super Power"
L/R: Licensed by Royal,"Action, Adventure, Mystery, Police"
La Rose de Versailles,"Drama, Historical, Military, Romance, Shoujo Ai, Slice of Life"
La Seine no Hoshi,"Adventure, Drama, Historical, Shoujo"
Ladies versus Butlers!,"Comedy, Ecchi, Harem, Romance, School, Seinen"
Ladies versus Butlers! Specials,"Ecchi, Seinen"
Ladies versus Butlers! Tokuten Disc Music Clip,"Ecchi, Music"
Lady Georgie,"Drama, Historical, Romance, Shoujo"
Lady Jewelpet,"Fantasy, Magic, Romance, Shoujo"
Lady Lady!!,"Drama, Historical"
Lady Lady!! (1988),"Drama, Shoujo"
Lamune,"Drama, Romance, Slice of Life"
Lance N&#039; Masques,Fantasy
Landlock,"Adventure, Fantasy, Sci-Fi"
Lao Fu Zi Shui Hu Chuan,"Comedy, Historical, Seinen"
Last Exile,"Action, Adventure, Sci-Fi"
Last Exile: Ginyoku no Fam,"Action, Adventure, Sci-Fi"
Last Exile: Ginyoku no Fam Movie - Over the Wishes,"Action, Adventure, Sci-Fi"
Last Exile: Ginyoku no Fam Recaps,"Action, Adventure, Sci-Fi"
Last Orders,"Action, Samurai, Sci-Fi"
Last Waltz: Hakudaku Mamire no Natsu Gasshuku,Hentai
Layton Kyouju to Eien no Utahime,Mystery
Le Chevalier D&#039;Eon,"Historical, Magic, Mystery, Seinen, Supernatural"
Leatherman,Hentai
Legend of Basara,"Adventure, Drama, Romance, Shoujo"
Legend of Basara: Shinbashi Theater,Comedy
Legend of Crystania OVA,"Action, Adventure, Fantasy, Magic, Supernatural"
Legend of Duo,"Drama, Shounen Ai, Supernatural, Vampire"
Legend of Lemnear: Kyokuguro no Tsubasa Valkisas,"Action, Adventure, Fantasy"
Legend of Regios,Magic
Legendz: Yomigaeru Ryuuou Densetsu,"Action, Adventure, Comedy, Fantasy"
Lemon Angel (1988),Ecchi
Lemon Angel (1988/II),Ecchi
Lemon Angel Project,"Drama, Music"
Leopard Eyes,Music
Les Misérables: Shoujo Cosette,"Drama, Historical, Shoujo, Slice of Life"
Lesbian Byoutou,Hentai
Lesson XX,"Romance, Shounen Ai"
Let&#039;s Nupu Nupu,"Comedy, Ecchi, School"
Level E,"Comedy, Sci-Fi, Shounen"
Licca-chan Fushigi na Fushigi na Yunia Monogatari,"Adventure, Kids"
Licca-chan Fushigi na Mahou no Ring,"Adventure, Fantasy"
Licca-chan no Nichiyoubi,Adventure
Life no Color,"Music, School"
Light Lag,Music
Lily C.A.T.,"Horror, Sci-Fi, Space"
Lily to Kaeru to (Otouto),"Adventure, Comedy, Supernatural"
Lime-iro Ryuukitan X,"Drama, Ecchi, Harem, Historical, Mecha, Supernatural"
Lime-iro Senkitan,"Drama, Ecchi, Harem, Historical, Mecha, Supernatural"
Lime-iro Senkitan: Nankoku Yume Roman,"Action, Comedy, Ecchi, Mecha"
Ling Qi,"Action, Comedy, Magic, Supernatural"
Lingerie Senshi Papillon Rose,"Ecchi, Magic, Parody, Sci-Fi"
Lingeries,Hentai
Litchi DE Hikari Club,"Comedy, Drama, Horror, Psychological, Romance"
Little Busters!,"Comedy, Drama, School, Slice of Life, Supernatural"
Little Busters!: EX,"Comedy, Drama, Romance, School, Slice of Life, Supernatural"
Little Busters!: Refrain,"Comedy, Drama, Romance, School, Slice of Life, Supernatural"
Little Busters!: Sekai no Saitou wa Ore ga Mamoru!,"Comedy, School, Slice of Life"
Little El Cid no Bouken,"Adventure, Historical, Kids"
Little Lulu to Chicchai Nakama,"Comedy, Kids, Slice of Life"
Little Monica Monogatari,Hentai
Little Nemo,"Adventure, Fantasy"
Little Nemo Pilot,Adventure
Little Witch Academia,"Adventure, Comedy, Fantasy, Magic, School"
Little Witch Academia: Mahoujikake no Parade,"Adventure, Comedy, Fantasy, Magic, School"
Live On Cardliver Kakeru,"Fantasy, Game"
Lo Re: Pako Sukusuku Mizuki-chan The Animation,Hentai
Lodoss-tou Senki,"Action, Adventure, Fantasy, Magic, Shounen, Supernatural"
Lodoss-tou Senki: Eiyuu Kishi Den,"Action, Adventure, Drama, Fantasy, Magic, Romance"
Log Horizon,"Action, Adventure, Fantasy, Game, Magic, Shounen"
Log Horizon 2nd Season,"Action, Adventure, Fantasy, Game, Magic, Shounen"
Log Horizon Recap,"Action, Adventure, Fantasy, Magic, Shounen"
Lolita Anime,Hentai
Lost Forest,Music
Lost Universe,"Adventure, Comedy, Drama, Sci-Fi, Shounen, Space"
Lost Utopia,"Action, Fantasy, Music, Seinen, Supernatural"
Loups=Garous,"Mystery, Sci-Fi, Thriller"
Loups=Garous Picture Drama,"Mystery, Sci-Fi"
Love 2 Quad,Hentai
Love Bitch: Yasashii Onna,Hentai
Love Bites,Horror
Love Colon,Hentai
Love Forever,Hentai
Love Get Chu,"Comedy, Romance"
Love Hina,"Comedy, Ecchi, Harem, Romance, Shounen, Slice of Life"
Love Hina Again,"Comedy, Drama, Ecchi, Romance, Shounen"
Love Hina Christmas Special: Silent Eve,"Comedy, Romance, Slice of Life"
Love Hina Final Selection,"Comedy, Ecchi, Harem, Romance"
Love Hina Haru Special: Kimi Sakura Chiru Nakare!!,"Adventure, Comedy, Romance"
"Love Hina: Motoko no Sentaku, Koi ka Ken... &quot;Naku na&quot;","Drama, Romance, Slice of Life"
Love Lab,"Comedy, Romance, School"
Love Like Aliens,"Action, Music, Sci-Fi"
Love Live! Kouhaku Special Anime,Music
Love Live! School Idol Project,"Music, School, Slice of Life"
Love Live! School Idol Project 2nd Season,"Music, School, Slice of Life"
Love Live! School Idol Project 2nd Season Recap,"Music, School, Slice of Life"
Love Live! School Idol Project OVA,"Music, School, Slice of Life"
Love Live! School Idol Project Recap,"Music, School, Slice of Life"
Love Live! School Idol Project: μ&#039;s →NEXT LoveLive! 2014 - Endless Parade Encore Animation,Comedy
Love Live! School Idol Project: μ&#039;s →NEXT LoveLive! 2014 - Endless Parade Makuai Drama,Comedy
Love Live! Sunshine!!,"Music, School, Slice of Life"
Love Live! The School Idol Movie,"Music, School, Slice of Life"
Love Live! x Watering KissMint Collaboration CM,Music
Love Position: Halley Densetsu,"Fantasy, Sci-Fi"
Love Selection The Animation,Hentai
Love Stage!!,"Comedy, Romance, Shounen Ai"
Love Stage!! OVA,"Comedy, Romance, Shounen Ai"
Love es M The Animation,Hentai
Love to Live By,Music
Lovedol: Lovely Idol,"Harem, Music"
Lovedol: Lovely Idol OVA,"Comedy, Drama, Ecchi, Harem, Music"
Loveless,"Action, Drama, Fantasy, Mystery, Romance, Shoujo, Shounen Ai, Supernatural"
Loveless Specials,"Comedy, Fantasy, Romance, Shounen Ai, Supernatural"
Lovely Day: Boku to Kanojo no Nana Nichikan,Hentai
Lovely x Cation The Animation,Hentai
Lovely★Complex,"Comedy, Romance, Shoujo"
Love♥Love?,"Comedy, Ecchi, Harem, Romance"
Love♥Love? Specials,"Comedy, Ecchi, Harem, Romance"
Lu Shidai,"Action, Adventure, Comedy, Game, Parody"
Lu Shidai 2nd Season,"Action, Adventure, Comedy, Game, Parody"
Luck &amp; Logic,"Action, Fantasy"
Lucky☆Star,"Comedy, Parody, School, Slice of Life"
Lucky☆Star: Original na Visual to Animation,"Comedy, Parody, School, Slice of Life"
Luger Code 1951,"Action, Fantasy"
Luigi&#039;s Toy Adventure,Adventure
Lunatic Night,"Comedy, Hentai, Parody"
Lunn wa Kaze no Naka,"Drama, Romance"
Lupin III,"Action, Adventure, Comedy, Shounen"
Lupin III (2015),"Action, Adventure, Comedy, Shounen"
Lupin III (2015) Specials,"Action, Adventure, Comedy, Shounen"
Lupin III (2015): Italian Game,"Action, Adventure, Comedy, Shounen"
Lupin III vs. Detective Conan,"Action, Adventure, Comedy, Mystery, Shounen"
Lupin III vs. Detective Conan: The Movie,"Action, Comedy, Mystery, Shounen"
Lupin III: $1 Money Wars,"Action, Adventure, Comedy, Shounen"
Lupin III: Ai no Da Capo - Fujiko&#039;s Unlucky Days,"Action, Adventure, Comedy, Shounen"
Lupin III: Alcatraz Connection,"Action, Adventure, Comedy, Shounen"
Lupin III: Babylon no Ougon Densetsu,"Action, Adventure, Comedy, Shounen"
Lupin III: Bye Bye Liberty - Kiki Ippatsu!,"Action, Adventure, Comedy, Shounen"
Lupin III: Cagliostro no Shiro,"Adventure, Comedy, Shounen"
Lupin III: Chi no Kokuin - Eien no Mermaid,"Action, Adventure, Comedy, Shounen"
Lupin III: Dead or Alive,"Action, Adventure, Comedy, Shounen"
Lupin III: Episode 0 &quot;First Contact&quot;,"Action, Adventure, Comedy, Mystery, Shounen"
Lupin III: Fuuma Ichizoku no Inbou,"Action, Adventure, Comedy, Shounen"
Lupin III: Green vs. Red,"Action, Comedy, Mystery, Shounen"
Lupin III: Harimao no Zaihou wo Oe!!,"Action, Adventure, Comedy, Shounen"
Lupin III: Hemingway Paper no Nazo,"Action, Adventure, Comedy, Mystery, Shounen"
Lupin III: Honoo no Kioku - Tokyo Crisis,"Action, Adventure, Comedy, Mystery, Shounen"
Lupin III: Ikiteita Majutsushi,"Adventure, Comedy, Shounen"
Lupin III: Kiri no Elusive,"Action, Adventure, Comedy, Shounen"
Lupin III: Kutabare! Nostradamus,"Action, Adventure, Comedy, Shounen"
Lupin III: Lupin Ansatsu Shirei,"Action, Adventure, Comedy, Shounen"
Lupin III: Lupin Ikka Seizoroi,"Adventure, Comedy, Shounen"
Lupin III: Lupin vs. Fukusei-ningen,"Action, Adventure, Comedy, Mystery, Shounen"
Lupin III: Moeyo Zantetsuken!,"Action, Adventure, Comedy, Shounen"
Lupin III: Napoleon no Jisho wo Ubae,"Action, Adventure, Comedy, Shounen"
Lupin III: Nusumareta Lupin,"Action, Adventure, Comedy, Shounen"
Lupin III: Otakara Henkyaku Daisakusen!!,"Adventure, Comedy, Shounen"
Lupin III: Part II,"Action, Adventure, Comedy, Shounen"
Lupin III: Part III,"Action, Adventure, Comedy, Shounen"
Lupin III: Pilot Film,"Action, Comedy, Shounen"
Lupin III: Princess of the Breeze - Kakusareta Kuuchuu Toshi,"Action, Adventure, Comedy, Shounen"
Lupin III: Russia yori Ai wo Komete,"Action, Adventure, Comedy, Shounen"
Lupin III: Secret File,"Adventure, Comedy, Shounen"
Lupin III: Seven Days Rhapsody,"Action, Adventure, Comedy, Shounen"
Lupin III: Sweet Lost Night - Mahou no Lamp wa Akumu no Yokan,"Adventure, Comedy, Shounen"
Lupin III: Tenshi no Tactics - Yume no Kakera wa Koroshi no Kaori,"Action, Adventure, Comedy, Shounen"
Lupin III: The Last Job,"Adventure, Comedy, Shounen"
Lupin III: Touhou Kenbunroku - Another Page,"Action, Adventure, Comedy, Mystery, Shounen"
Lupin III: Twilight Gemini no Himitsu,"Action, Adventure, Comedy, Shounen"
Lupin III: Walther P-38,"Action, Adventure, Comedy, Mystery, Shounen"
Lupin VIII,"Adventure, Comedy, Shounen"
Lupin tai Holmes,Mystery
Lupin the IIIrd: Jigen Daisuke no Bohyou,"Action, Adventure, Comedy, Drama, Seinen"
Lupin the Third,"Adventure, Music"
Lupin the Third: Mine Fujiko to Iu Onna,"Action, Adventure, Comedy, Ecchi, Samurai, Seinen"
Luv Wave,"Action, Drama, Hentai, Horror, Mystery, Police, Romance, Sci-Fi"
M Ogui: Last Order,Hentai
M.E.M.: Yogosareta Junketsu,Hentai
M3: Sono Kuroki Hagane,"Action, Drama, Mecha, Mystery, Psychological, Sci-Fi"
M3: Sono Kuroki Hagane Recap,"Action, Mecha"
MAPS,"Adventure, Comedy, Sci-Fi"
MD Geist II: Death Force,"Mecha, Military, Sci-Fi"
MEMORiES MELODiES,Music
MM!,"Comedy, Ecchi, Harem, School"
MM! Specials,"Comedy, Ecchi, School"
MONSTER GENERATiON,Music
MTV Japan Station ID,Music
Ma ga Ochiru Yoru,Hentai
MaMa,Hentai
Maabou no Daikyousou,"Comedy, Sports"
Maabou no Kinoshita Toukichirou,Samurai
Maburaho,"Comedy, Drama, Ecchi, Harem, Magic, Romance, School"
Macademi Wasshoi!,"Comedy, Ecchi, Fantasy, Romance, School, Supernatural"
Mach GoGoGo,"Adventure, Cars, Shounen, Sports"
Mach GoGoGo (1997),"Adventure, Cars"
Machi Gurumi no Wana: Hakudaku ni Mamireta Shitai,Hentai
Machi Ichiban no Kechinbou,"Drama, Historical, Music, Supernatural"
Machikado no Märchen,Romance
Machine Robo: Revenge of Chronos,"Action, Mecha, Sci-Fi"
Machine-Doll wa Kizutsukanai,"Action, Ecchi, Fantasy, School, Seinen"
Machine-Doll wa Kizutsukanai Specials,"Action, Ecchi, Fantasy, School, Seinen"
Macross,"Action, Mecha, Military, Music, Romance, Sci-Fi, Space"
Macross 25th Anniversary: All That VF Macross F Version,"Action, Mecha, Sci-Fi"
Macross 25th Anniversary: All That VF Macross Zero Version,"Action, Mecha, Sci-Fi"
Macross 7,"Action, Adventure, Comedy, Drama, Mecha, Military, Music, Romance, Sci-Fi, Shounen"
Macross 7 Encore,"Action, Comedy, Drama, Mecha, Music, Sci-Fi, Shounen"
Macross 7 Movie: Ginga ga Ore wo Yondeiru!,"Action, Adventure, Comedy, Drama, Mecha, Music, Sci-Fi, Shounen"
Macross 7 Plus,"Mecha, Music, Slice of Life"
Macross Dynamite 7,"Adventure, Comedy, Mecha, Sci-Fi, Shounen"
Macross F,"Action, Mecha, Military, Music, Romance, Sci-Fi, Space"
Macross F Movie 1: Itsuwari no Utahime,"Action, Mecha, Military, Music, Romance, Sci-Fi, Space"
Macross F Movie 2: Sayonara no Tsubasa,"Action, Mecha, Military, Music, Romance, Sci-Fi, Space"
Macross F Music Clip Shuu: Nyankuri,Music
Macross F: Choujikuu Gekijou,"Comedy, Slice of Life"
Macross F: Close Encounter - Deculture Edition,"Action, Mecha, Military, Music, Sci-Fi, Space"
Macross FB7: Ore no Uta wo Kike!,"Action, Mecha, Music, Romance, Sci-Fi"
Macross Flash Back 2012,"Drama, Mecha, Military, Sci-Fi"
Macross Fufonfia,"Comedy, Parody"
Macross Fufonfia Specials,"Comedy, Parody"
Macross II: Lovers Again,"Adventure, Mecha, Military, Sci-Fi, Shounen, Space"
Macross Plus,"Drama, Mecha, Military, Romance, Sci-Fi, Space"
Macross Plus Movie Edition,"Action, Adventure, Mecha, Military, Romance, Sci-Fi, Space"
Macross XX,"Action, Mecha"
Macross Zero,"Adventure, Mecha, Military, Sci-Fi, Shounen"
Macross Δ,"Action, Mecha, Military, Music, Romance, Sci-Fi, Space"
Macross: Do You Remember Love?,"Action, Mecha, Military, Music, Romance, Sci-Fi, Space"
Madan no Ou to Vanadis,"Adventure, Ecchi, Fantasy, Harem, Romance"
Madan no Ou to Vanadis: Tigre-kun to Vanadi-chu,Comedy
Madang-Eul Naon Amtalg,"Adventure, Drama, Fantasy, Kids"
Madlax,"Drama, Magic, Military, Mystery, Psychological, Shounen, Supernatural"
Mado,Comedy
Madobe Nanami no Windows 7 de PC Jisaku Ouen Commercial!!,Comedy
Madonna,"Comedy, School, Sports"
Madonna: Kanjuku Body Collection,"Harem, Hentai"
Madou King Granzort,"Action, Comedy, Fantasy, Magic, Mecha, Sci-Fi, Shounen"
Madou King Granzort: Saigo no Magical Taisen,"Action, Comedy, Fantasy, Magic, Mecha, Sci-Fi, Shounen"
Mad★Bull 34,"Action, Police"
Maetel Legend,"Drama, Sci-Fi, Space"
Maeterlinck no Aoi Tori: Tyltyl Mytyl no Bouken Ryokou,"Adventure, Fantasy"
Magi: Sinbad no Bouken,"Action, Adventure, Fantasy, Magic, Shounen"
Magi: Sinbad no Bouken (TV),"Action, Adventure, Fantasy, Magic, Shounen"
Magi: The Kingdom of Magic,"Action, Adventure, Fantasy, Magic, Shounen"
Magi: The Labyrinth of Magic,"Action, Adventure, Fantasy, Magic, Shounen"
Magic Kaito,"Adventure, Comedy, Romance, Shounen"
Magic Kaito 1412,"Adventure, Comedy, Romance, Shounen"
Magic Knight Rayearth,"Adventure, Comedy, Drama, Fantasy, Magic, Mecha, Romance, Shoujo"
Magic Knight Rayearth II,"Adventure, Drama, Fantasy, Magic, Mecha, Romance, Shoujo"
Magic Knight Rayearth Omake,"Adventure, Comedy, Drama, Fantasy, Magic, Mecha, Romance, Shoujo"
Magic Tree House,"Adventure, Magic"
Magical Canan,"Drama, Fantasy, Magic, Supernatural"
Magical Hat,"Adventure, Comedy, Fantasy, Kids"
Magical Moe,"Hentai, Magic"
Magical Nyan Nyan Taruto,"Comedy, Magic"
Magical Twilight,"Comedy, Hentai, Magic, Romance"
Magical Witch Academy: Boku to Sensei no Magical Lesson The Animation,Hentai
Magical☆Star Kanon 100%,"Magic, Music, Shounen"
Magikano,"Comedy, Fantasy, Harem, Magic, Romance, Shounen"
Magma Taishi,"Action, Sci-Fi, Shounen, Space, Super Power"
Mahjong Hishouden: Naki no Ryuu,"Action, Drama, Game, Seinen"
Mahoraba: Heartful days,"Comedy, Drama, Romance, Shounen"
Mahoromatic 2,"Comedy, Drama, Ecchi, Military, Romance, Sci-Fi"
Mahoromatic 2 End Year Special,"Comedy, Ecchi, Military, Romance, Sci-Fi"
Mahoromatic End Year Special,"Comedy, Ecchi, Military, Romance, Sci-Fi"
Mahoromatic Summer Special,"Comedy, Ecchi, Romance, Sci-Fi"
Mahoromatic: Automatic Maiden,"Comedy, Ecchi, Military, Romance, Sci-Fi"
Mahoromatic: I&#039;m Home!,"Comedy, Ecchi, Romance, Sci-Fi"
Mahou Gakuen Lunar! Aoi Ryuu no Himitsu,"Comedy, Fantasy, Magic"
Mahou Sensei Negima!,"Comedy, Ecchi, Fantasy, Harem, Magic, Romance, School, Shounen, Super Power, Supernatural"
Mahou Sensei Negima! Anime Final,"Adventure, Magic, Supernatural"
Mahou Sensei Negima! Introduction Film,"Action, Comedy, Ecchi, Harem, Romance, Supernatural"
