name,genre
Rozen Maiden (2013),"Action, Comedy, Drama, Magic, Seinen"
Rozen Maiden: Meitantei Kunkun - Duell Walzer,"Comedy, Mystery"
Rozen Maiden: Ouvertüre,"Action, Comedy, Drama, Magic, Seinen"
Rozen Maiden: Träumend,"Action, Comedy, Drama, Magic, Seinen"
Rumiko Takahashi Anthology,"Comedy, Drama, Romance, Shounen, Slice of Life, Supernatural"
Run=Dim,"Action, Mecha, Sci-Fi"
Rurouni Kenshin DVD-BOX Special Ending,"Historical, Romance"
Rurouni Kenshin Recap,"Action, Adventure, Comedy, Historical, Romance, Samurai"
Rurouni Kenshin Special,"Action, Historical, Romance, Samurai"
Rurouni Kenshin: Meiji Kenkaku Romantan,"Action, Adventure, Comedy, Historical, Romance, Samurai"
Rurouni Kenshin: Meiji Kenkaku Romantan - Ishinshishi e no Chinkonka,"Drama, Historical, Samurai, Shounen"
Rurouni Kenshin: Meiji Kenkaku Romantan - Seisou-hen,"Drama, Historical, Romance, Samurai, Shounen"
Rurouni Kenshin: Meiji Kenkaku Romantan - Shin Kyoto-hen,"Action, Drama, Historical, Samurai, Shounen"
Rurouni Kenshin: Meiji Kenkaku Romantan - Tsuioku-hen,"Action, Drama, Historical, Martial Arts, Romance, Samurai"
Rurouni Kenshin: Review Special,"Action, Comedy, Samurai, Shounen"
Rurouni Kenshin: Special Techniques,"Action, Comedy, Samurai"
Rusty Nail,"Action, Music, Sci-Fi"
Ryo,"Action, Drama, Historical, Samurai"
Ryojoku no Rensa,Hentai
Ryokan Shirasagi,Hentai
Ryokunohara Meikyuu,"Dementia, Drama, Psychological, Romance, Shounen Ai"
Ryou Seibai!: Gakuen Bishoujo Seisai Hiroku,Hentai
Ryoujoku Famiresu Choukyou Menu,Hentai
Ryoujoku Guerrilla Kari 3,Hentai
Ryoujoku Hitozuma Onsen,Hentai
Ryoujoku Joshi Gakuen,Hentai
Ryoujoku no Machi: Kyouen no Ceremony,"Fantasy, Hentai, Military"
Ryouki no Ori: Dai 2 Shou,Hentai
Ryoutei no Aji,Slice of Life
Ryuu Seiki,"Action, Demons, Fantasy, Sci-Fi"
Ryuugajou Nanana no Maizoukin,"Comedy, Supernatural"
Ryuugajou Nanana no Maizoukin (TV),"Comedy, Supernatural"
Ryuugajou Nanana no Maizoukin (TV) Specials,Comedy
Ryuusei Sentai Musumet,"Adventure, Comedy, Ecchi, Romance, Sci-Fi"
Ryuusei Tenshi Primaveil,Hentai
Ryuusei no Rockman,"Action, Game, Sci-Fi, Shounen"
Ryuusei no Rockman Tribe,Adventure
Ryuuseiki Gakusaver,"Action, Comedy, Mecha, Parody, School, Sci-Fi, Space"
R²: Rise R to the Second Power,Music
SAI: Part 1 / Revolving... to the Core,"Fantasy, Music"
SD Gundam Force,"Adventure, Comedy, Fantasy, Mecha"
SD Gundam Gaiden,"Adventure, Comedy, Fantasy, Mecha"
SD Gundam Sangokuden Brave Battle Warriors,"Action, Historical, Mecha"
SF Saiyuuki Starzinger,"Adventure, Mecha, Sci-Fi, Shounen, Space"
SF Shinseiki Lensman,"Action, Adventure, Sci-Fi, Space"
SKET Dance,"Comedy, School, Shounen"
SKET Dance OVA,"Comedy, School, Shounen"
SKET Dance: Demystifying Special,"School, Shounen"
SKET Dance: SD Character Flash Anime,"Comedy, School, Shounen"
SMAnime,"Action, Seinen"
STAR BEAT!: Hoshi no Kodou,Music
Saa Ikou! Tamagotchi,Kids
Sabagebu!,"Action, Comedy, Military, Shoujo"
Sabagebu! Specials,"Action, Comedy, Military, Shoujo"
Saber Marionette J,"Action, Adventure, Comedy, Drama, Harem, Martial Arts, Mecha, Romance, Sci-Fi, Shounen"
Saber Marionette J Again,"Action, Comedy, Harem, Mecha, Romance, Sci-Fi"
Saber Marionette J to X,"Action, Adventure, Comedy, Harem, Mecha, Sci-Fi"
Saber Marionette R,"Action, Comedy, Harem, Mecha, Sci-Fi"
Saboten ga Nikui,"Comedy, Kids, Music"
Sabu to Ichi Torimono Hikae,"Action, Adventure, Drama, Historical, Martial Arts, Police, Samurai, Shounen, Slice of Life"
Sacred Seven,"Action, School, Sci-Fi, Super Power"
Sacred Seven: Shirogane no Tsubasa,"Action, School, Sci-Fi, Super Power"
Sacred Seven: Shirogane no Tsubasa Picture Drama,"Action, Comedy, School, Sci-Fi, Super Power"
Saenai Heroine no Sodatekata,"Comedy, Ecchi, Harem, Romance, School"
Saenai Heroine no Sodatekata: Ai to Seishun no Service Kai,"Comedy, Ecchi, Harem, Romance"
"Sagashita no wa Oheya, Mitsuketa no wa Mirai","Romance, Slice of Life"
Saibi,"Drama, Psychological, Thriller"
Saigo no Door wo Shimero!,"Comedy, Drama, Romance, Yaoi"
Saijaku Muhai no Bahamut,"Action, Ecchi, Fantasy, Harem, Mecha, Romance, School, Supernatural"
Saiki Kusuo no Ψ-nan,"Comedy, School, Shounen, Supernatural"
"Saikin, Imouto no Yousu ga Chotto Okashiinda ga.","Comedy, Ecchi, Romance, Shounen, Supernatural"
"Saikin, Imouto no Yousu ga Chotto Okashiinda ga. OVA","Comedy, Ecchi, Romance, Shounen, Supernatural"
Saiko Robot Kombock,"Mecha, Sci-Fi"
Saikyou Ginga Ultimate Zero: Battle Spirits,Shounen
Sailor Fuku Shinryou Tsumaka,Hentai
Sailor Senshi Venus♥Five,"Hentai, Parody, Super Power"
Sailor Victory,"Action, Comedy, Mecha, Sci-Fi"
Saimin Gakuen,Hentai
Saimin Jutsu The Animation 2nd,Hentai
Saimin Jutsu Zero,Hentai
Saimin Ryoujoku Gakuen,Hentai
Saint Beast: Ikusen no Hiru to Yoru-hen,"Fantasy, Magic"
Saint Beast: Kouin Jojishi Tenshi Tan,Fantasy
Saint Beast: Seijuu Kourin-hen,"Action, Fantasy, Magic, Supernatural"
Saint Luminous Jogakuin,"Mystery, Psychological, Supernatural"
Saint October,"Adventure, Fantasy"
Saint Seiya,"Adventure, Fantasy, Sci-Fi, Shounen"
Saint Seiya Omega,"Action, Adventure, Fantasy, Shounen"
Saint Seiya: Jashin Eris,"Adventure, Sci-Fi, Shounen"
Saint Seiya: Kamigami no Atsuki Tatakai,"Adventure, Sci-Fi, Shounen"
Saint Seiya: Legend of Sanctuary,"Adventure, Fantasy, Sci-Fi, Shounen"
Saint Seiya: Meiou Hades Elysion-hen,"Action, Fantasy, Shounen, Super Power"
Saint Seiya: Meiou Hades Juuni Kyuu-hen,"Adventure, Sci-Fi, Shounen"
Saint Seiya: Meiou Hades Meikai-hen,"Action, Adventure, Demons, Fantasy, Sci-Fi, Shounen, Super Power"
Saint Seiya: Saishuu Seisen no Senshi-tachi,"Adventure, Sci-Fi, Shounen"
Saint Seiya: Shinku no Shounen Densetsu,"Adventure, Fantasy, Sci-Fi, Shounen"
Saint Seiya: Soul of Gold,"Action, Adventure, Fantasy, Sci-Fi, Shounen"
Saint Seiya: Soushuuhen,"Adventure, Fantasy, Sci-Fi, Shounen"
Saint Seiya: Tenkai-hen Josou - Overture,"Adventure, Sci-Fi, Shounen"
Saint Seiya: The Hades Chapter Sanctuary - Yomigaerishi Gold Saint-tachi no Shinwa,"Adventure, Sci-Fi, Shounen"
Saint Seiya: The Lost Canvas - Meiou Shinwa,"Action, Adventure, Martial Arts, Shounen, Super Power, Supernatural"
Saint Seiya: The Lost Canvas - Meiou Shinwa 2,"Action, Adventure, Martial Arts, Shounen, Super Power, Supernatural"
Saint☆Oniisan,"Comedy, Seinen, Slice of Life"
Saint☆Oniisan (Movie),"Comedy, Seinen, Slice of Life"
Saishuu Chikan Densha,Hentai
Saishuu Chikan Densha Next,Hentai
Saishuu Heiki Kanojo,"Drama, Romance, School, Sci-Fi"
Saishuu Heiki Kanojo: Another Love Song,"Drama, Romance, Sci-Fi"
Saishuu Shiken Kujira,"Comedy, Ecchi, Mystery, School, Supernatural"
Saishuu Shiken Kujira Progressive,"Drama, Romance"
Saiunkoku Monogatari,"Adventure, Comedy, Drama, Fantasy, Historical, Romance"
Saiunkoku Monogatari 2nd Season,"Adventure, Comedy, Drama, Fantasy, Historical, Romance"
Saiunkoku Monogatari Soushuuhen,"Adventure, Comedy, Drama, Fantasy, Historical, Romance"
Saiyuuki,Adventure
Saiyuuki Gaiden,"Action, Adventure, Drama, Fantasy, Shoujo"
Saiyuuki Gaiden: Tokubetsu-hen - Kouga no Shou,"Adventure, Drama, Fantasy, Shoujo"
Saiyuuki Reload,"Action, Adventure, Comedy, Drama, Fantasy, Shoujo"
Saiyuuki Reload Gunlock,"Action, Adventure, Comedy, Fantasy, Shoujo"
Saiyuuki Reload: Burial,"Action, Adventure, Drama, Fantasy, Shoujo"
Saiyuuki: Son Gokuu Monogatari,Adventure
Sakamichi no Apollon,"Drama, Josei, Music, Romance, School"
Sakamoto desu ga?,"Comedy, School, Seinen"
Sakamoto desu ga? Special,"Comedy, School, Seinen"
Sakasama no Patema,"Sci-Fi, Seinen"
Sakasama no Patema: Beginning of the Day,Sci-Fi
Saki,"Game, School, Slice of Life"
Saki Achiga-hen: Episode of Side-A,"Game, School, Slice of Life"
Saki Achiga-hen: Episode of Side-A - Kuro no Tanjoubi,"Game, School, Slice of Life"
Saki Achiga-hen: Episode of Side-A Specials,"Game, School, Slice of Life"
Saki Biyori Animation,"Comedy, School, Seinen, Slice of Life"
Saki Picture Drama,"Comedy, Slice of Life"
Saki Zenkoku-hen,"Game, School, Slice of Life"
Sakigake!! Cromartie Koukou,"Comedy, School, Shounen"
Sakigake!! Otokojuku,"Action, Comedy, Martial Arts, School, Shounen"
Sakigake!! Otokojuku Movie,"Action, Comedy, Martial Arts, School, Shounen"
Sakura,Fantasy
Sakura Capusule,"Kids, Slice of Life"
Sakura Nagashi,"Action, Drama, Mecha, Music, Sci-Fi"
Sakura Taisen,"Adventure, Mecha, Sci-Fi, Shounen"
Sakura Taisen: Ecole de Paris,"Action, Adventure, Game, Harem, Mecha, Sci-Fi"
Sakura Taisen: Gouka Kenran,"Adventure, Mecha, Sci-Fi, Shounen"
Sakura Taisen: Kanadegumi,Shoujo
Sakura Taisen: Katsudou Shashin,"Adventure, Mecha, Sci-Fi, Shounen"
Sakura Taisen: Le Nouveau Paris,"Adventure, Mecha, Sci-Fi, Shounen"
Sakura Taisen: New York,"Adventure, Comedy, Supernatural"
Sakura Taisen: Ouka Kenran,"Adventure, Mecha, Sci-Fi, Shounen"
Sakura Taisen: Sumire,"Adventure, Drama, Mecha, Sci-Fi, Shounen"
Sakura Trick,"Comedy, Romance, School, Seinen, Shoujo Ai, Slice of Life"
Sakura Tsuushin,"Comedy, Drama, Romance, Slice of Life"
Sakurako-san no Ashimoto ni wa Shitai ga Umatteiru,Mystery
Sakurasou no Pet na Kanojo,"Comedy, Drama, Romance, School, Slice of Life"
Salad Juu Yuushi Tomatoman,"Adventure, Comedy"
Salad Land,Fantasy
Salamander,"Adventure, Sci-Fi"
Salaryman Kintarou,"Comedy, Drama, Seinen"
Samayou Midara na Lunatics,Hentai
Samero,Dementia
Samurai 7,"Historical, Mecha, Samurai, Sci-Fi"
Samurai Champloo,"Action, Adventure, Comedy, Historical, Samurai, Shounen"
Samurai Deeper Kyou,"Adventure, Comedy, Historical, Shounen, Supernatural"
Samurai Flamenco,"Action, Comedy, Parody"
Samurai Girl Real Bout High School,"Adventure, Comedy, Fantasy, Shounen"
Samurai Gun,"Action, Historical, Seinen"
Samurai Gun Special,"Action, Historical, Seinen"
Samurai Hormone The Animation,Hentai
Samurai Spirits 2: Asura Zanmaden,"Action, Fantasy, Martial Arts, Samurai, Super Power"
Samurai Spirits: Haten Gouma no Shou,"Adventure, Historical, Samurai, Shounen"
Sanctuary,"Action, Drama, Police, Seinen, Thriller"
Sango Shou Densetsu: Aoi Umi no Elfie,"Adventure, Sci-Fi"
Sangokushi (1985),Historical
Sangokushi Daiichibu Eiyuu-tachi no Yoake,Historical
Sangokushi Dainibu Choukou Moyu,"Action, Historical"
Sangokushi Daisanbu Harukanaru Taichi,"Action, Historical"
Sangokushi II: Amakakeru Otoko-tachi,"Action, Historical"
Sankarea,"Comedy, Ecchi, Horror, Romance, Shounen, Supernatural"
Sankarea OVA,"Comedy, Ecchi, Horror, Romance, Shounen, Supernatural"
Sankarea: Wagahai mo... Zombie de Aru...,"Comedy, Ecchi, Horror, Romance, Shounen, Supernatural"
Sankou to Tako: Hyakumanryou Chinsoudou,Action
Sanrio Anime Sekai Meisaku Gekijou,"Adventure, Fantasy, Kids"
Sansha Sanyou,"Comedy, School, Slice of Life"
Sansha Sanyou Specials,"Comedy, School, Slice of Life"
Santa Company,Fantasy
Sanzoku no Musume Ronja,Adventure
Saraba Uchuu Senkan Yamato: Ai no Senshi-tachi,"Action, Drama, Military, Sci-Fi, Space"
Saraiya Goyou,"Historical, Samurai, Seinen"
Saru Getchu: On Air,"Adventure, Comedy, Fantasy, Kids, Romance, Shounen"
Saru Kani Gassen,Kids
Saru Kani Gassen,Drama
Saru Masamune,"Adventure, Military"
Saru to Kani no Gassen,Drama
Sarusuberi: Miss Hokusai,"Drama, Historical, Supernatural"
Sarutobi Ecchan,"Comedy, Kids, Magic, School"
Sasameki Koto,"Comedy, Romance, School, Shoujo Ai"
Sasami-san@Ganbaranai,"Comedy, Romance, Supernatural"
Sasami: Mahou Shoujo Club,"Fantasy, Magic, School"
Sasami: Mahou Shoujo Club 2,"Fantasy, Magic, School"
Sasuga no Sarutobi,"Action, Adventure, Comedy, Martial Arts, Romance, Sports"
Sasuke,"Action, Historical, Martial Arts, Shounen"
Sasurai no Shoujo Nell,"Adventure, Historical, Shoujo"
Satsujin Kippu wa Heart-iro,"Mystery, Shoujo"
Satsujinkyou Jidai,Fantasy
Sayonara Ginga Tetsudou 999: Andromeda Shuuchakueki,"Adventure, Drama, Sci-Fi, Space"
Sayonara Zetsubou Sensei,"Comedy, Parody, School"
Sayonara Zetsubou Sensei Jo: Zetsubou Shoujo Senshuu,"Comedy, Parody, School"
Sayonara Zetsubou Sensei Jo: Zoku Zetsubou Shoujo Senshuu,"Comedy, Parody, School"
Sayonara Zetsubou Sensei Special,"Comedy, Mystery, Parody"
Sayonara Zetsubou Sensei Special Omake,"Comedy, Parody, School"
Scan2Go,"Cars, Kids, Shounen, Space, Sports"
Scandal,"Music, Slice of Life"
Scared Rider Xechs,"Adventure, Harem, Romance, Sci-Fi"
Schick x Evangelion,"Comedy, Parody"
School,Hentai
School Days,"Drama, Harem, Romance, School"
School Days ONA,"Drama, Romance, School"
School Days: Magical Heart Kokoro-chan,"Comedy, Ecchi, Magic"
School Days: Valentine Days,"Comedy, Romance, School"
School Rumble,"Comedy, Romance, School, Shounen"
School Rumble Ichi Gakki Hoshuu,"Comedy, Romance, School, Shounen"
School Rumble Ni Gakki,"Comedy, Romance, School, Shounen"
School Rumble San Gakki,"Comedy, Romance, School, Shounen"
Schwarzesmarken,"Action, Drama, Historical, Mecha, Military, Sci-Fi"
Sci-fi Harry,"Drama, Horror, Sci-Fi"
Scramble Wars: Tsuppashire! Genom Trophy Rally,Parody
Scrapped Princess,"Adventure, Comedy, Drama, Fantasy, Mecha, Sci-Fi, Shounen"
Scryed Alteration I: Tao,"Action, Adventure, Sci-Fi, Shounen, Super Power"
Scryed Alteration II: Quan,"Action, Adventure, Sci-Fi, Shounen, Super Power"
SeeIn AO,Hentai
Sei Brunehilde Gakuen Shoujo Kishidan to Junpaku no Panty The Animation,Hentai
Sei Juushi Bismarck,"Action, Mecha, Sci-Fi, Space"
Sei Michaela Gakuen Hyouryuuki,Hentai
Sei Shoujo Sentai Lakers EX,"Hentai, Sci-Fi"
Sei Shoujo The Animation,Hentai
Sei Yariman Gakuen Enkou Nikki The Animation,Hentai
Sei Yariman Sisters Pakopako Nikki The Animation,Hentai
Seifuku Shojo The Animation,Hentai
Seigi wo Aisuru Mono Gekkou Kamen,"Action, Mystery"
Seihou Bukyou Outlaw Star,"Action, Adventure, Comedy, Sci-Fi, Space"
Seihou Bukyou Outlaw Star Pilot,"Action, Sci-Fi, Space"
Seihou Bukyou Outlaw Star Specials,"Action, Adventure, Comedy, Ecchi, Sci-Fi"
Seihou Tenshi Angel Links,"Action, Adventure, Comedy, Drama, Romance, Sci-Fi, Space"
Seijun Kango Gakuin,"Comedy, Hentai"
Seijuuden: Twin Dolls,"Action, Demons, Hentai, Magic, Supernatural"
Seijuuki Cyguard,"Mecha, Sci-Fi, Supernatural"
Seikai no Danshou: Tanjou,"Military, Romance, Sci-Fi, Space"
Seikai no Monshou,"Action, Military, Romance, Sci-Fi, Space"
Seikai no Monshou Special,"Action, Military, Romance, Sci-Fi, Space"
Seikai no Senki,"Action, Military, Romance, Sci-Fi, Space"
Seikai no Senki II,"Action, Military, Romance, Sci-Fi, Space"
Seikai no Senki III,"Action, Military, Romance, Sci-Fi, Space"
Seikai no Senki Special,"Action, Military, Romance, Sci-Fi, Space"
Seikatsu Shidou!! Anime Edition,Hentai
Seiken Tsukai no World Break,"Action, Fantasy, Harem, Romance, School, Supernatural"
Seiken no Blacksmith,"Action, Adventure, Fantasy"
Seikima II Humane Society: Jinrui Ai ni Michita Shakai,"Demons, Supernatural"
Seikimatsu Occult Gakuin,"Comedy, Mystery, School, Sci-Fi, Supernatural"
Seikimatsu Occult Gakuin Specials,"Comedy, School, Supernatural"
Seikimatsu★Darling,"Comedy, Drama, Romance, Shounen Ai"
Seikoku no Dragonar,"Comedy, Ecchi, Fantasy, School"
Seikon no Qwaser,"Action, Ecchi, Seinen, Super Power, Supernatural"
Seikon no Qwaser II,"Action, Ecchi, Seinen, Super Power, Supernatural"
Seikon no Qwaser II Picture Drama,"Ecchi, Yuri"
Seikon no Qwaser Picture Drama,Ecchi
Seikon no Qwaser: Jotei no Shouzou,"Action, Ecchi, Seinen, Super Power, Supernatural"
Seikou!: Osananajimi wa Terekusasou ni Uso wo Tsuku,Hentai
Seikoujo: Haitoku no Biden Dorei,Hentai
Seimei no Kagaku: Micro Patrol,Adventure
Seirei Tsukai,"Action, Adventure, Fantasy, Magic, Romance, Shounen, Supernatural"
Seirei Tsukai no Blade Dance,"Action, Comedy, Ecchi, Fantasy, Harem, Romance, School, Supernatural"
Seirei Tsukai no Blade Dance Specials,"Action, Ecchi, Fantasy, School, Supernatural"
Seirei no Moribito,"Action, Adventure, Fantasy, Historical"
Seisai,"Dementia, Fantasy, Hentai, Horror"
Seisen Cerberus: Ryuukoku no Fatalités,"Adventure, Fantasy"
Seisen Gakuin,Hentai
Seishou Jogangu Alice Doll,Hentai
Seishoujo Kantai Virgin Fleet,"Fantasy, Military, School, Sci-Fi"
Seishun Anime Zenshuu,"Drama, Historical, Romance"
Seishun Fuufu Monogatari: Koiko no Mainichi,"Comedy, Drama, Ecchi, Romance, Seinen"
Seitokai Yakuindomo,"Comedy, School, Shounen, Slice of Life"
Seitokai Yakuindomo OVA,"Comedy, School, Shounen, Slice of Life"
Seitokai Yakuindomo*,"Comedy, School, Shounen, Slice of Life"
Seitokai no Ichizon,"Comedy, Harem, Parody, School"
Seitokai no Ichizon Lv.2,"Comedy, Harem, Parody, School"
Seitokai no Ichizon Lv.2: Watasu Seitokai,"Comedy, Harem, Parody, School"
Seitokaichou Hikaru,Hentai
Seitokaichou ni Chuukoku,"Comedy, Drama, Romance, School, Yaoi"
Seiyou Kottou Yougashiten: Antique,"Comedy, Shoujo, Shounen Ai"
Seiyuu Deka,"Comedy, Magic"
Sekai Kei Sekai Ron,"Psychological, Sci-Fi"
Sekai Meisaku Douwa: Aladdin to Mahou no Lamp,"Adventure, Fantasy"
Sekai Meisaku Douwa: Hakuchou no Mizuumi,"Drama, Fantasy, Romance"
Sekai Meisaku Douwa: Hakuchou no Ouji,Fantasy
Sekai Meisaku Douwa: Mori wa Ikiteiru,"Fantasy, Kids"
Sekai Meisaku Douwa: Oyayubi Hime,"Fantasy, Kids"
Sekai Meisaku Douwa: Wow! Maerchen Oukoku,Fantasy
Sekai Seifuku: Bouryaku no Zvezda,"Action, Comedy, Fantasy"
Sekai Seifuku: Bouryaku no Zvezda - Shin Zvezda Daisakusen,"Action, Comedy, Fantasy"
Sekai de Ichiban Tsuyoku Naritai!,"Action, Ecchi, Sports"
Sekai de Ichiban Tsuyoku Naritai! Specials,"Action, Ecchi, Sports"
Sekaiichi Hatsukoi,"Comedy, Drama, Romance, Shounen Ai"
Sekaiichi Hatsukoi 2,"Comedy, Drama, Romance, Shounen Ai"
Sekaiichi Hatsukoi Movie: Yokozawa Takafumi no Baai,"Comedy, Drama, Romance, Shounen Ai"
Sekaiichi Hatsukoi OVA,"Comedy, Drama, Romance, Shounen Ai"
Sekaiichi Hatsukoi: Valentine-hen,"Comedy, Romance, Shounen Ai"
Sekiei Ayakashi Mangatan,"Fantasy, Historical, Supernatural"
Sekiranun Graffiti,Music
Sekirei,"Action, Comedy, Ecchi, Harem, Super Power"
Sekirei: Hajimete no Otsukai,Comedy
Sekirei: Pure Engagement,"Action, Comedy, Ecchi, Harem, Super Power"
Sekirei: Pure Engagement - Kanwa ni Dai,"Comedy, Ecchi, Harem"
Sekishoku Elegy,Romance
Sekkou Boys,"Comedy, Music"
Selector Destructed WIXOSS Movie,"Game, Psychological"
Selector Infected WIXOSS,"Game, Psychological"
Selector Infected WIXOSS: Midoriko-san to Piruruku-tan,Comedy
Selector Spread WIXOSS,"Game, Psychological"
Self-Portrait,"Comedy, Demons"
Seme♥Chichi,Hentai
Sen to Chihiro no Kamikakushi,"Adventure, Drama, Supernatural"
Sengoku Basara,"Action, Historical, Martial Arts, Samurai, Super Power"
Sengoku Basara Movie: 4-Koma Gekijou - Another Last Party,"Comedy, Historical"
Sengoku Basara Movie: The Last Party,"Action, Historical, Martial Arts, Samurai, Super Power"
Sengoku Basara Two,"Action, Historical, Martial Arts, Samurai, Super Power"
"Sengoku Basara Two: Ryuko, Itadaki no Chikai! Atsuki Mirai e Kakeru Tamashii!!","Action, Historical, Samurai"
Sengoku Basara: Judge End,"Action, Historical, Martial Arts, Samurai, Super Power"
Sengoku Basara: Setonai no Gekitotsu! Hi wo Fuku Umi no Daiyousai - Fugaku!!,"Action, Historical, Martial Arts, Samurai"
Sengoku Collection,"Fantasy, Parody, Samurai"
Sengoku Kitan Youtouden,"Action, Demons, Martial Arts"
Sengoku Kitan Youtouden Soushuuhen,"Action, Martial Arts, Samurai"
Sengoku Majin Goushougun,"Mecha, Parody, Sci-Fi"
Sengoku Majin Goushougun (Movie),"Mecha, Parody, Sci-Fi"
Sengoku Majin Goushougun: Toki no Etranger,"Action, Sci-Fi"
Sengoku Musou,"Action, Historical, Samurai"
Sengoku Musou SP: Sanada no Shou,"Action, Historical, Samurai"
Sengoku Musou: Sengoku Musou High School,"Comedy, Samurai, School"
Sengoku Otome: Momoiro Paradox,"Action, Comedy, Historical, Samurai, Sci-Fi, Super Power"
Sengoku☆Paradise Kiwami,"Action, Comedy, Drama, Historical, Romance, Samurai, Shoujo"
Senjou no Valkyria,"Action, Military, Romance"
Senjou no Valkyria 3: Tagatame no Juusou,"Action, Fantasy, Military"
Senjou no Valkyria: SenVal Theater,Comedy
Senkaiden Houshin Engi,"Adventure, Fantasy, Historical, Magic, Shounen, Supernatural"
"Senki Zesshou Symphogear G: In the Distance, That Day, When the Star Became Music...","Action, Music, Sci-Fi"
"Senki Zesshou Symphogear G: In the Distance, That Day, When the Star Became Music... Specials",Comedy
Senki Zesshou Symphogear GX: Believe in Justice and Hold a Determination to Fist.,"Action, Music, Sci-Fi"
Senki Zesshou Symphogear GX: Believe in Justice and Hold a Determination to Fist. Specials,"Action, Music, Sci-Fi"
"Senki Zesshou Symphogear: Meteoroid-Falling, Burning, and Disappear, Then...","Action, Music, Sci-Fi"
Senkou no Night Raid,"Action, Historical, Military, Super Power"
Senkou no Night Raid Picture Drama,"Action, Historical, Super Power"
Senkou no Night Raid Specials,"Action, Historical, Military, Super Power"
Senkou no Night Raid: Yogen,"Action, Historical, Military, Super Power"
Sennen Joyuu,"Action, Adventure, Drama, Fantasy, Historical, Romance"
Senran Kagura,"Action, Comedy, Ecchi, School"
Senran Kagura Specials,Ecchi
Senran Kagura: Estival Versus - Shoujo-tachi no Sentaku,"Action, Comedy, Ecchi"
Sensei no Ojikan: Doki Doki School Hours,"Comedy, Slice of Life"
Sensei no Ojikan: Doki Doki School Hours OVA,"Comedy, School"
Sensitive Pornograph,"Comedy, Drama, Hentai, Romance, Yaoi"
Sensou no Tsukurikata,"Drama, Kids"
Sentakuya Shin-chan,Hentai
Sentimental Journey,"Drama, Romance, Shoujo"
Sentou Mecha Xabungle,"Mecha, Military, Sci-Fi, Shounen"
Sentou Yousei Shoujo Tasukete! Mave-chan,"Comedy, Parody, Sci-Fi, Shounen, Super Power"
Sentou Yousei Yukikaze,"Action, Drama, Military, Psychological, Sci-Fi, Space"
Senya Ichiya Monogatari,"Fantasy, Hentai"
Senyuu.,"Action, Comedy, Fantasy, Parody, Shounen"
Senyuu. 2,"Action, Comedy, Fantasy, Parody, Shounen"
Senyuu. Specials,"Action, Comedy, Fantasy, Shounen"
Septem Charm Magical Kanan,"Hentai, Magic, Romance, School"
Septem Charm Magical Kanan: SP Summer Camp,Hentai
Sequence,"Romance, Sci-Fi, Shoujo"
Seraphim Call,"Drama, Romance, Sci-Fi"
Serial Experiments Lain,"Dementia, Drama, Mystery, Psychological, Sci-Fi, Supernatural"
Servamp,"Action, Comedy, Drama, Josei, Supernatural, Vampire"
Servant x Service,"Comedy, Slice of Life"
Seto no Hanayome,"Comedy, Parody, Romance, School"
Seto no Hanayome Fan Disc,"Comedy, Parody, School"
Seto no Hanayome OVA,"Comedy, Parody, Romance, School"
Seto no Hanayome OVA Specials,"Comedy, Parody, School"
Seto no Hanayome Picture Drama,"Comedy, Parody, Romance, School"
Seton Doubutsuki,"Adventure, Fantasy"
Seton Doubutsuki: Kuma no Ko Jacky,"Adventure, Drama, Historical"
Seton Doubutsuki: Risu no Banner,"Drama, Kids"
Sex Pistols,"Comedy, Drama, Supernatural, Yaoi"
Sexfriend,Hentai
Sexy Commando Gaiden: Sugoiyo!! Masaru-san,"Comedy, Martial Arts, School, Shounen"
Sexy Commando Gaiden: Sugoiyo!! Masaru-san Specials,"Comedy, Martial Arts, School, Shounen"
Sexy Sailor Soldiers,"Action, Comedy, Hentai, Super Power"
Shabura Rental: Ecchi na Oneesan to no Eroero Rental Obenkyou The Animation,Hentai
Shadow Skill,"Adventure, Drama, Fantasy, Shounen"
Shadow Skill (1996),"Adventure, Drama, Fantasy, Shounen"
Shadow Skill: Eigi,"Adventure, Drama, Fantasy, Magic, Martial Arts, Shounen, Super Power"
Shadow Skill: Kurudaryuu Kousatsuhou no Himitsu,"Adventure, Drama, Fantasy, Shounen"
Shakkin Shimai,"Hentai, School"
Shakotan★Boogie,"Action, Cars, Comedy, School, Seinen"
Shakugan no Shana,"Action, Drama, Fantasy, Romance, School, Supernatural"
Shakugan no Shana II (Second),"Action, Drama, Fantasy, Romance, School, Supernatural"
Shakugan no Shana II (Second) Specials,"Comedy, Parody"
Shakugan no Shana III (Final),"Action, Drama, Fantasy, Romance, Supernatural"
Shakugan no Shana III (Final) Specials,"Comedy, Parody"
Shakugan no Shana Movie,"Action, Fantasy, Supernatural"
Shakugan no Shana Movie Special,"Adventure, Comedy, Fantasy, Parody"
Shakugan no Shana S,"Action, Drama, Fantasy, Romance, School, Supernatural"
Shakugan no Shana S Specials,"Comedy, Parody"
Shakugan no Shana SP: Koi to Onsen no Kougai Gakushuu!,"Comedy, Ecchi, Fantasy, Romance, Slice of Life"
Shakugan no Shana Specials,"Comedy, Parody"
Shakugan no Shana: Friagne to Marianne no Naze Nani Shana! Nandemo Shitsumonbako!,"Comedy, Fantasy, Supernatural"
Shakugan no Shana: Friagne to Marianne no Naze Nani Shana! Nandemo Shitsumonbako! 2,"Comedy, Fantasy, Supernatural"
Shakugan no Shana: Naze Nani Shana! Nandemo Shitsumonbako! Special,"Comedy, Fantasy, Supernatural"
Shakugan no Shana: Shana &amp; Yuuji no Naze Nani Shana! Nandemo Shitsumon-bako!,"Comedy, Fantasy, Supernatural"
Shaman King,"Action, Adventure, Comedy, Drama, Shounen, Supernatural"
Shaman King Specials,"Action, Comedy, Shounen, Supernatural"
Shamanic Princess,"Action, Fantasy, Magic, Romance"
Shameshrine Andorora,"Hentai, Sci-Fi"
Shangri-La,"Action, Drama, Sci-Fi"
Shashinkan,"Drama, Historical, Slice of Life"
SheepWolf,"Comedy, Kids"
Shelter,"Music, Sci-Fi"
Shenmue: The Movie,"Action, Adventure, Game, Martial Arts"
Shiawase no Uta,"Historical, Kids, Music"
Shiawasette Naani,Fantasy
Shibai Taroka,"Action, Comedy, Romance, School, Shounen"
Shibainuko-san,Comedy
Shichinin no Nana,"Adventure, Comedy, Magic, Romance, School"
Shigatsu wa Kimi no Uso,"Drama, Music, Romance, School, Shounen"
Shigatsu wa Kimi no Uso: Moments,"Music, Shounen"
Shigeru,"Comedy, Dementia"
Shigofumi,"Drama, Fantasy, Psychological, Supernatural, Thriller"
Shigofumi Picture Drama,Comedy
Shigofumi Special,"Drama, Fantasy, Psychological, Thriller"
Shigurui,"Action, Drama, Historical, Martial Arts, Samurai, Seinen"
Shihaisha no Tasogare,"Action, Demons, Drama, Horror, Sci-Fi, Shoujo, Supernatural"
Shiiba-san no Ura no Kao. with Imouto Lip,Hentai
Shijin no Shougai,"Drama, Fantasy, Psychological"
Shijou Saikyou no Deshi Kenichi,"Action, Comedy, Martial Arts, School, Shounen"
